<?xml version="1.0" encoding="UTF-8" standalone="no"?>
<!DOCTYPE carta SYSTEM "carta.dtd">

<carta xmlns:tap="tapas.xml"
	xmlns:ens="ensaladas.xml"
	xmlns:pya="pastasYArroces.xml"
	xmlns:car="carnes.xml"
	xmlns:pes="pescados.xml"
	xmlns:veg="vegana.xml"
	xmlns:sgl="sinGluten.xml"
	xmlns:pos="postres.xml"
	xmlns:beb="bebidas.xml"
	xmlns:vin="vinos.xml">
	<tap:tapas>
		<tap:producto>
			<tap:id></tap:id>
			<tap:nombre></tap:nombre>
			<tap:descripcion></tap:descripcion>
			<tap:alergenos></tap:alergenos>
			<tap:precio></tap:precio>
		</tap:producto>
	</tap:tapas>
	<ens:ensaladas>
		<ens:producto>
			<ens:id></ens:id>
			<ens:nombre></ens:nombre>
			<ens:descripcion></ens:descripcion>
			<ens:alergenos></ens:alergenos>
			<ens:precio></ens:precio>
		</ens:producto>
	</ens:ensaladas>
	<pya:pastaYArroces>
		<pya:producto>
			<pya:id></pya:id>
			<pya:nombre></pya:nombre>
			<pya:descripcion></pya:descripcion>
			<pya:alergenos></pya:alergenos>
			<pya:precio></pya:precio>
		</pya:producto>
	</pya:pastaYArroces>
	<car:carnes>
		<car:producto>
			<car:id></car:id>
			<car:nombre></car:nombre>
			<car:descripcion></car:descripcion>
			<car:alergenos></car:alergenos>
			<car:precio></car:precio>
		</car:producto>
	</car:carnes>
	<pes:pescados>
		<pes:producto>
			<pes:id></pes:id>
			<pes:nombre></pes:nombre>
			<pes:descripcion></pes:descripcion>
			<pes:alergenos></pes:alergenos>
			<pes:precio></pes:precio>
		</pes:producto>
	</pes:pescados>
	<veg:vegana>
		<veg:producto>
			<veg:id></veg:id>
			<veg:nombre></veg:nombre>
			<veg:descripcion></veg:descripcion>
			<veg:alergenos></veg:alergenos>
			<veg:precio></veg:precio>
		</veg:producto>
	</veg:vegana>
	<sgl:sinGluten>
		<sgl:producto>
			<sgl:id></sgl:id>
			<sgl:nombre></sgl:nombre>
			<sgl:descripcion></sgl:descripcion>
			<sgl:alergenos></sgl:alergenos>
			<sgl:precio></sgl:precio>
		</sgl:producto>
	</sgl:sinGluten>
	<pos:postres>
		<pos:producto>
			<pos:id></pos:id>
			<pos:nombre></pos:nombre>
			<pos:descripcion></pos:descripcion>
			<pos:alergenos></pos:alergenos>
			<pos:precio></pos:precio>
		</pos:producto>
	</pos:postres>
	<beb:bebidas>
		<beb:producto>
			<beb:id></beb:id>
			<beb:nombre></beb:nombre>
			<beb:descripcion></beb:descripcion>
			<beb:alergenos></beb:alergenos>
			<beb:precio></beb:precio>
		</beb:producto>
	</beb:bebidas>
	<vin:vinos>
		<vin:producto>
			<vin:id></vin:id>
			<vin:nombre></vin:nombre>
			<vin:descripcion></vin:descripcion>
			<vin:alergenos></vin:alergenos>
			<vin:precio></vin:precio>
		</vin:producto>
	</vin:vinos>
</carta>